{
  "$schema": "https://json-schema.org/draft/2020-12/schema",
  "$id": "https://example.internal/pdlc/delivery-flow.schema.json",
  "title": "Delivery Flow Definition",
  "type": "object",
  "required": [
    "schemaVersion",
    "id",
    "name",
    "description",
    "status",
    "stageSequence"
  ],
  "properties": {
    "schemaVersion": {
      "const": 2
    },
    "id": {
      "type": "string"
    },
    "name": {
      "type": "string"
    },
    "description": {
      "type": "string"
    },
    "status": {
      "enum": [
        "active",
        "planned",
        "deprecated"
      ]
    },
    "stageSequence": {
      "type": "array",
      "minItems": 1,
      "items": {
        "type": "object",
        "required": [
          "stageId",
          "inclusion"
        ],
        "properties": {
          "stageId": {
            "type": "string"
          },
          "inclusion": {
            "enum": [
              "required",
              "conditional"
            ]
          },
          "activationTags": {
            "type": "array",
            "items": {
              "type": "string"
            }
          }
        },
        "additionalProperties": false
      }
    },
    "controls": {
      "type": "object",
      "required": [
        "initialStatus",
        "terminalStatuses",
        "checkpoints",
        "deliveryDefaults",
        "constraints"
      ],
      "properties": {
        "initialStatus": {
          "type": "string",
          "minLength": 1
        },
        "terminalStatuses": {
          "type": "array",
          "minItems": 1,
          "items": { "type": "string", "minLength": 1 }
        },
        "checkpoints": {
          "type": "array",
          "minItems": 1,
          "items": {
            "type": "object",
            "required": ["id", "from", "ownerRole"],
            "properties": {
              "id": { "type": "string", "minLength": 1 },
              "from": {
                "type": "array",
                "minItems": 1,
                "items": { "type": "string", "minLength": 1 }
              },
              "to": { "type": "string", "minLength": 1 },
              "toByOutcome": {
                "type": "object",
                "minProperties": 1,
                "additionalProperties": { "type": "string", "minLength": 1 }
              },
              "ownerRole": { "type": "string", "minLength": 1 },
              "contextStages": {
                "type": "array",
                "minItems": 1,
                "uniqueItems": true,
                "items": { "type": "string", "minLength": 1 }
              }
            },
            "oneOf": [
              { "required": ["to"], "not": { "required": ["toByOutcome"] } },
              { "required": ["toByOutcome"], "not": { "required": ["to"] } }
            ],
            "additionalProperties": false
          }
        },
        "deliveryDefaults": {
          "type": "object",
          "required": ["roleAssignmentMode", "timebox", "collectDuringRequirements"],
          "properties": {
            "roleAssignmentMode": {
              "type": "string",
              "pattern": "^[a-z][a-z0-9-]*$"
            },
            "timebox": { "type": "string", "minLength": 1 },
            "collectDuringRequirements": { "type": "boolean" },
            "requirementsProfile": { "enum": ["minimal", "standard", "comprehensive"] }
          },
          "additionalProperties": false
        },
        "constraints": {
          "type": "object",
          "required": ["productionUse", "externalIntegrations", "allowSinglePersonAllRoles"],
          "properties": {
            "productionUse": { "type": "boolean" },
            "externalIntegrations": {
              "type": "array",
              "items": { "type": "string", "minLength": 1 }
            },
            "allowSinglePersonAllRoles": { "type": "boolean" }
          },
          "additionalProperties": false
        }
      },
      "additionalProperties": false
    },
    "runtime": {
      "type": "object",
      "properties": {
        "executor": { "type": "string", "minLength": 1 },
        "recordSchema": { "type": "string", "minLength": 1 },
        "actions": {
          "type": "array",
          "uniqueItems": true,
          "items": { "type": "string", "minLength": 1 }
        }
      },
      "dependentRequired": { "actions": ["executor"] },
      "additionalProperties": false
    }
  },
  "allOf": [
    {
      "if": { "properties": { "status": { "const": "active" } } },
      "then": { "required": ["controls"] },
      "else": { "not": { "anyOf": [{ "required": ["controls"] }, { "required": ["runtime"] }] } }
    }
  ],
  "additionalProperties": false
}
