{
  "schemaVersion": 2,
  "id": "pdlc",
  "name": "End-to-End PDLC Delivery Flow",
  "description": "The planned complete Delivery Flow from ideation through requirements, implementation, release, and outcome review.",
  "status": "planned",
  "stageSequence": [
    { "stageId": "ideation-intake", "inclusion": "required" },
    { "stageId": "problem-framing", "inclusion": "required" },
    { "stageId": "stakeholder-context", "inclusion": "required" },
    { "stageId": "business-architecture-alignment", "inclusion": "required" },
    { "stageId": "hypothesis-definition", "inclusion": "required" },
    { "stageId": "success-measures", "inclusion": "required" },
    { "stageId": "scope-definition", "inclusion": "required" },
    { "stageId": "requirements-clarification", "inclusion": "required" },
    { "stageId": "requirements-analysis", "inclusion": "required" },
    { "stageId": "acceptance-criteria-definition", "inclusion": "required" },
    { "stageId": "data-integration-boundaries", "inclusion": "required" },
    { "stageId": "risk-classification", "inclusion": "required" },
    { "stageId": "requirements-approval", "inclusion": "required" },
    { "stageId": "work-item-planning", "inclusion": "required" },
    { "stageId": "solution-design", "inclusion": "required" },
    { "stageId": "ux-design", "inclusion": "conditional", "activationTags": ["technology:web-ui", "technology:mobile-ui"] },
    { "stageId": "test-strategy", "inclusion": "required" },
    { "stageId": "delivery-planning", "inclusion": "required" },
    { "stageId": "build-readiness", "inclusion": "required" },
    { "stageId": "implementation", "inclusion": "required" },
    { "stageId": "developer-verification", "inclusion": "required" },
    { "stageId": "security-verification", "inclusion": "conditional", "activationTags": ["risk:sensitive-data", "risk:external-access", "risk:credentials", "risk:regulated-data"] },
    { "stageId": "test-case-preparation", "inclusion": "required" },
    { "stageId": "test-execution", "inclusion": "required" },
    { "stageId": "acceptance-verification", "inclusion": "required" },
    { "stageId": "release-readiness", "inclusion": "required" },
    { "stageId": "deployment", "inclusion": "required" },
    { "stageId": "production-validation", "inclusion": "required" },
    { "stageId": "outcome-review-and-disposition", "inclusion": "required" }
  ]
}
